"ProviderKey";"Gtin";"BrandName";"CategoryGroup_1";"CategoryGroup_2";"CategoryGroup_3";"ProductCategory";"Weight_g";"ProductTitle_de";"TARESCode";"TARICCode";"CountryOfOrigin";"ManufacturerKey";"Length_m";"Width_m";"Height_m";"ReleaseDate_CH";"VariantName";"ProductTitle_en";"ProductTitle_fr";"LongDescription_de";"Composition_de";"Application_de"
"AAA-001";7611824311178;"Namnori";"IT-Hardware";"PC-Peripherie";"Verbrauchsmaterial Drucker";"Tinte";15.5;"C13T12824010";"8423.101";"1234 5678 90 9";"CN";"VI-230.45";0.01;0.005;0.005.;"04.07.2018";"VI-230";"C13T12824010";"C13T12824010";"Tinte ""C13T12824010"", Druckleistung Seiten: 300  ×, Toner/Tinte Farbe: Yellow.";;
"AAA-002";7640115640215;"Namnori";"IT-Hardware";"PC-Peripherie";"Verbrauchsmaterial Drucker";"Tinte";27.2;"C13T12834025";"8423.101";"1234 5678 90 9";"CN";"VI-230.33";0.01;0.007;0.005.;"04.07.2016";"VI-230";"C13T12834025";"C13T12834025";"Tinte ""C13T12834025"",  Druckleistung Seiten: 530  ×, Toner/Tinte Farbe: Black.";;
"AAA-004";7611422260755;"Namtab";"Fahrzeugfunktechnik";"Funktechnik";"Zubehör Funktechnik";"Zubehör";12.3;"PMLN4605";"8423.109";"1236 5655 90 8";"CN";"PMLN4605";0.23;0.33.;.0.2.;"02.03.2018";"PMLN";"PMLN4605";"PMLN4605";"Security Akustikschlauch PMLN4605, Zubehörtyp Funktechnik: Headset, Security Headset zu PMLN4294.";;
"BBB-001";7611824321177;"Namtab";"Werkstatt";"Werkzeug";"Handwerkzeug";"Hammer";360;"Thor 2.0";"9025.118";"1237 5670 01 2";"CN";"VI-245.75";0.22;0.1;0.05;"24.07.2018";"VI-245";"Thor 2.0";"Thor 2.0";"Schlosserhammer Work mit einem Gewicht von 500 g. Der Glasfaserstiel und der rutschfeste Griff bewährleisten eine angenehme Arbeitsweise.";;
"BBB-003";7611824311154;"Namtab";"Werkstatt";"Werkzeug";"Handwerkzeug";"Hammer";400;"Thor 3.0";"9025.118";"1237 5670 01 2";"CN";"VI-245.76";0.28;0.1;0.05;"14.05.2019";"VI-245";"Thor 3.0";"Thor 3.0";"Schlosserhammer Work mit einem Gewicht von 500 g. Der Glasfaserstiel und der rutschfeste Griff bewährleisten eine angenehme Arbeitsweise.";;
"CCC-001";4003053091700;"Aptamil";"Diätetische Lebensmittel";"Babyernährung";"Säuglingsnahrung für besondere Ernährungsbedürfnisse";"Säuglingsmilch";498;"Pregomin Plv";"3027.1101";"1372 4650 01 1";"CH";"146571";0.01;0.01;0.02.;"";"";"Pregomin Plv";"Pregomin Plv";"Aptamil Pregomin ist geeignet zum Diätmanagement bei Kuhmilchproteinallergie und Malabsorption. Aptamil Pregomin kann zur ausschließlichen Ernährung Ihres Babys von Geburt an verwendet werden. Beachten Sie bei der Zubereitung von Aptamil Pregomin genau die Gebrauchsanweisung. Unsachgemäße Zubereitung und Lagerung können zu gesundheitlichen Beeinträchtigungen durch Wachstum unerwünschter Keime führen. Bereiten Sie die Nahrung vor jeder Mahlzeit frisch zu und füttern Sie diese sofort. Nahrungsreste nicht wiederverwenden. Flasche, Sauger und Ring gründlich reinigen. Erwärmen Sie Milchnahrung nicht in der Mikrowelle (Überhitzungsgefahr).";"Glucosesirup, hydrolysiertes Molkenprotein (aus MILCH), pflanzliche Öle (mittelkettige Triglyceride (aus Kokosnuss- ud Palmöl), Raps-, Sonnenblumen-, Palmöl), Maltodextrin, Calciumorthophosphat, Kaliumcitrat, Emulgator (Citronensäureester von Mono- und Diglyceriden von Speisefettsäuren), FISCHÖL, Calciumchlorid, Kaliumorthophosphat, Öl aus Mortierella alpina, Cholinchlorid Magnesiumorthophosphat, Vitamin C, Inositol, Taurin Natriumchlorid, Kaliumchlorid, L-Carnitin, Eisen-II-sulfat, Zinksulfat, Vitamin E, Nucleotide (Natriumsalue von Uridin-, Cytidin-, Adenosin, Inosin-, Guanosin-5-Monophosphat), Antioxidationsmittel (Ascorbylpalmitat), Pantothensäure, Niacin, Kupfersulfat, Vitamin B2, Vitamin A, Vitamin B1, Vitamin B6, Kaliumjodid, Folsäure, Natriumselenit, Mangan-II-sulfat, Vitamin K, Biotin, Vitamin D, Vitamin B12";"1. Frisches, abgekochtes Trinkwasser auf ca. 40 °C abkühlen lassen und 2/3 der benötigten Wassermenge in die Flasche geben. 2. Für eine genaue Dosierung des Pulvers den beiliegenden Messlöffel mit dem Messerrücken abstreifen. Nur den beiliegenden Messlöffel verwenden. 3. Benötigte Menge Pulver in die Flasche geben. Flasche verschließen und kräftig schütteln, restliche Trinkwassermenge dazugießen und den Flascheninhalt nochmals kräftig schütteln. 4. Flasche öffnen und Sauger befestigen. Flascheninhalt auf Trinktemperatur (ca. 37 °C) überprüfen. Anzahl und Trinkmenge pro Fläschchen variieren individuell. Die durchschnittliche Trinkmenge Aptamil ist je nach Alter, Gewicht und Verträglichkeit vom Arzt festzulegen. Die angegebenen Trinkmengen pro Tag sind nur empfohlene Richtwerte. Bitte verwenden Sie nur den beiliegenden Messlöffel, dieser fasst gestrichen voll ca. 4,5 g.Dosierung: Alter des Kindes = 1.Monat, Fläschchen pro Tag = 5-6, Trinkfertige Nahrung = 130 ml, Wasser = 120 ml"
"CCC-002";4028615070009;"syNeo";"";"";"Deodorants ";"Antitranspirant";106;"5 Man Vapo";"3007.1200";"3027.1101";"CH";"070-S5PS";0.002;0.003.;0.01;"";"";"5 Man Vapo";"5 Man Vapo";"Der bewährte, hochwirksame Klassiker in der Glasflasche reicht für über 40 Anwendungen (Achseln). Die Wirkung hält bis zu 5 Tage an. Die Flasche reicht für 6 Monate. Ohne Parfümstoffe. Hypoallergen: entwickelt, um Allergierisiken zu minimieren. Wirkt durch die besondere Wirkstoff-Kombination bereits nach der ersten Anwendung. Wirkt je nach Hauttyp bis zu 5 Tage und schützt so sicher vor Transpiration. Darüber hinaus kann Syneo 5 unangenehmen Körpergeruch bis zu 5 Tage verhindern. Allantoin schützt die Haut vor Irritationen und feuchtigkeitsspendende Stoffe bewahren sie vor dem Austrocknen. Dermatologisch getestet.";"Aqua, Alcohol denat., Aluminum Chloride, Aluminum Chlorohydrate, Glycerin, Propylene Glycol, Alcloxa, Saccharomyces Ferment, Dimethicone Copolyol, C.I. 42051";"in den Achselhöhlen, an den Füssen und anderen Körperregionen. Abends vor dem Schlafengehen waschen und gut abtrocknen. Kleidung erst nach dem Antrocknen anziehen. Syneo 5 am besten über Nacht einwirken lassen. Am nächsten Morgen wie gewohnt waschen oder duschen. Ohne Parfümstoffe. Syneo 5 erst bei Nachlassen der Wirkung wieder anwenden. Nach einer Achselrasur min. 6 Stunden mit der Anwendung warten. Nicht in Kombination mit anderen Deodorants an gleicher Stelle verwenden. Flasche reicht für etwa 40 Anwendungen (Achseln) je 5 Tage und hält bis zu 6 Monate!"
